{
  "derived_model_version": "0.1.0",
  "artifact_type": "EffectiveStateSnapshot",
  "regulator_profile": "ich",
  "records": [
    {
      "snapshot_id": "slice.m10.snapshot.001",
      "guidance_family_id": "slice.m10.family",
      "jurisdiction": "ICH",
      "as_of_date": "2022-05-24",
      "review_policy": "include_needs_review",
      "source_corpus_identity": "ich_m10@E306F3B6DC367EB2913CE242093A8F6C9DCD095A139A9FDB6D6F5E25201FA6AF",
      "calculation_policy_version": "m10-direct-slice-0.1",
      "effective_record_ids": ["slice.m10.eff.6_1.022"],
      "calculated_at": "2026-07-13T00:00:00Z",
      "review_status": "needs_review",
      "profile_details": null
    }
  ]
}
