{
  "derived_model_version": "0.1.0",
  "artifact_type": "EffectiveStateSnapshot",
  "regulator_profile": "core",
  "records": [
    {
      "snapshot_id": "fixture.snapshot.001",
      "guidance_family_id": "fixture.family.ich_s6",
      "jurisdiction": "ICH",
      "as_of_date": "2026-07-06",
      "review_policy": "include_needs_review",
      "source_corpus_identity": "fixture corpus",
      "calculation_policy_version": "fixture-policy-0",
      "effective_record_ids": ["fixture.effective.001"],
      "calculated_at": "2026-07-06T00:00:00Z",
      "review_status": "needs_review",
      "profile_details": null
    }
  ]
}
